<?xml version="1.0" encoding="UTF-8"?>

<!DOCTYPE document>

<document xmlns:xsi="http://www.w3.org/2001/XMLSchema" xsi:noNamespaceSchemaLocation="HD_ertoxsd.xsd">
	<A Aa="1">
		<Ab>
			<Abx>AX1</Abx>
			<Aby>AY1</Aby>
		</Ab>
		<Ab>
			<Abx>AX2</Abx>
			<Aby>AY2</Aby>
		</Ab>
		<Ac>
			<Acd>D</Acd>
			<Ace>E</Ace>
		</Ac>
	</A>
	<B Ba="1" Bc="1">
		<Bb>
			<Bbx>BX</Bbx>
			<Bby>BY</Bby>
		</Bb>
	</B>
	<C Ca="1">
		<Cb>B</Cb>
	</C>
	<A_B A_B_a="1" A_B_b="1">
		<A_Bc>C</A_Bc>
	</A_B>
</document>